User Name,Review Date,Review Body
Chris,"Reviewed in the United States on November 17, 2024","The author, the successful vice-presidential nominee in the 2024 presidential election, discusses his life story from his origins in a broken home in rural Ohio to graduating Yale Law School.

The author is a self-described hillbilly. Although neither he nor his parents were born in Appalachia, his grandparents were born and raised in Eastern Kentucky and migrated to Ohio for better opportunities. However, his grandparents maintained their connection to Appalachia. As a young person, the author would frequently travel to Kentucky and, perhaps most importantly, his family kept many of ""hillbilly"" habits. Some of these habits -- such as loyalty, especially to family -- are positive, whereas others -- such as a violent reaction to real or perceived infringements on persona honor -- are negative.

The major negative influence in the author's life was his mother. She went through a series of broken relationships and was a drug addict with mental health issues. Luckily, the author's grandparents proved a stabilizing and positive influence on his life. After he graduated high school, the author joined the Marines, then from there attended a public university (Ohio State) and an elite law school (Yale).

I feel somewhat of a connection to the author, as I also grew up in rural Appalachia, attended a non-prestigious public university for undergraduate studies and an elite law school. From a sociological perspective, there is not much to disagree with in this book. The author is correct that Appalachia -- never a prosperous or advanced region -- has in some ways fallen into even harder times, with broken homes and drug addiction plaguing the community. And the author is correct that these problems are not solely attributable to government failures or discrimination: a culture that rejects educational excellence, a tolerance for asocial behavior, a self-destructive honor code, and a loss of connection to religious institutions also condemn Appalachian people to poverty and chaos.

However, I sometimes felt that the author was ""playing it up"" for his intended audience of ""coastal elites"". At times, the author lets it slip that his family wasn't that poor -- by rural Appalachia standards, they appear to have been middle-class (although his mother's behavior was certainly reflective of the underclass). And the author, of course, wasn't born and raised in Appalachia, nor were his parents. Thus, I think the book may be more of interest to ""outsiders"" who want a glimpse into ""Trump country"", rather than for people who have lived lives closer to the author's."
Beardie mom,"Reviewed in the United States on January 27, 2025","Wow, we are lucky to have JD Vance in the White House. He clawed his way out of the hills to better himself but yet still has compassion for his roots & home of youth. My dad's family was from Morgan County KY & hill people. His aunt lived in Hazard up a creek bed. dad's parents moved to So. IL as farmers. As I read this book, I got a clear picture of how it probably was for my ancestors! A Fuller understanding of why family gatherings were so important & family traveled long distances to get together frequently; the hard working ethics; the desire to be something more & my dad & Uncles love of new cars to show off. They were dirt poor but each generation. Worked harder than the last to be better. This book is amazing that this young man a survived in a positive way due to perseverance & determination. To know he is now our V.Pres. of the 🇺🇸 & cares about those who are not
Elite status but real, common folks. Inspiring"
Gramma Kat,"Reviewed in the United States on February 6, 2025","The absolutely best book I've read in a very long time. I couldn't put it down; I read it in two days. It generated strong emotions: I laughed, I teared up, and kept kept reading (unsolicited) excerpts to my poor husband!! Coming from a dysfunctional family, I could relate to a lot of it, but never in my wildest dreams would I have imagined what this man lived through. I have the utmost respect for him and the family members that helped him through it. Be forewarned that there's a lot of cursing and off color conversations, but I belive they're needed to honestly describe the scenarios, and only serve to make it more realistic. A raw, gut-punch of a book that really takes you into the world of the poor and forgotten. I've already recommended it to several people, and can't praise it enough. Read it, you'll walk away with a changed perspective."
HT,"Reviewed in the United States on May 14, 2017","Subtitle: A Memoir of a Family and Culture in Crisis
The November 2016 election showed me I'm out of touch with middle America. I've been reading books this winter and spring to help me get a more accurate view of the problems facing the this group. This book, along with Thomas Friedmans ""Thank You for Being Late"", and Sam Quinones' ""Dreamland"" are other pieces to the puzzle.
J.D. Vance provides a brutal and personal overview of life in America for the working and non-working poor. As he says in the first few pages, ""I want people to understand what happens in the lives of the poor and the psychological impact that spiritual and material poverty has on their children.""[p 2] Vance shows us ""a culture that increasingly encourages social decay instead of counteracting it.""[p 7] Vance was able to escape this cycle of poverty and eventually graduated from Yale law school. It's almost a miracle he made it.
Vance's grandparents moved out of Appalachian Kentucky into Ohio following work. But the work wasn't long lasting; ""As millions migrated north to factory jobs, the communities that sprouted up around those factories were vibrant but fragile: When the factories shut their doors, the people left behind were trapped in towns an cities that could no longer support such large populations with high-quality work. Those who could - generally the well educated, wealthy, or well connected - left, leaving behind communities of poor people. These remaining folks were the 'truly disadvantaged' [quoting William Julius Wilson's book of that name] - unable to find good jobs on their own and surrounded by communities that offered little in the way of connections or social support.""[p 144]
These generations of poverty create a different environment. Domestic instability. Vance never really knew his biological father; his adoptive father left, and his mother went through a string of boyfriends who had no positive effect in J.D.'s or his sister's lives. of the picture.
As kids we learn what is acceptable from our parents; in much of poor America, domestic violence is acceptable. ""Mom and Bob's problems were my first introduction to marital conflict resolution. Here were the takeaways: Never speak at a reasonable volume when screaming will do; if the fight gets a little too intense, it's okay to slap and punch, so long as the man doesn't hit first; always express your feelings in a way that's insulting and hurtful to your partner; if all else fails, take the kids and the do to a local motel, and don't tell your spouse where to find you - if he or she knows where the children are, he or she won't worry as much, and your departure won't be as effective.""[p 71] Vance's mother took the familiar path we read about in Dreamland: She starts out as an alcoholic, becomes addicted to pain killers, and eventually shoots black tar heroin. ""Psychologists call the everyday occurrences of my and Lindsay's life 'adverse childhood experiences,' or 'ACE' ''ACE's are traumatic childhood events, and their consequences reach far into adulthood. The trauma need not be physical.""[p 226]
It's obvious that the deck is stacked against the children in this situation and there is no wondering why it happens generation after generation. You learn what is ""normal"" as a child. If this is normal, then keep doing it. People lose the belief that their actions can bring about change in their lives. Luckily J.D. Vance had a small opportunity for a way out and he was able to make the most of it. He left his mother to live with his grandmother (Mamaw) who provided love, stability, and structure, which, in turn helped J.D. graduate from high school. ""Psychologists call it learned helplessness' when a person believes, as I did during my youth, that the choices I made had no effect on the outcomes in my life. From Middletown's world of small expectations to the constant chaos of our home, life had taught me that I had no control. Mamaw and Papaw had saved me from succumbing entirely to that notion, and the Marine Corp broke new ground. If I had learned helplessness at home, the Marines were teaching learned willfulness.""[p 163]
J.D. Vance's takeaways are not the usual liberal tropes; he had a part-time job as a young adult and ""every two weeks, I'd get a small paycheck and notice the line where federal and state income taxes were deducted from my wages. At least as often, our drug-addict neighbor would buy T-bone steaks, which I was too poor to buy for myself but was forced by Uncle Sam to buy for someone else. ... it was my first indication that the policies of Mamaw's party of the working man'- the Democrats - weren't all they were cracked up to be.""[p 139]
So how do we fix this problem? While Vance shows the problems with many of the current ""solutions"", he doesn't really answer that question - which I think is the biggest drawback. He sums things up by saying ""I don't know what the answer is, precisely, but I know it starts when we stop blaming Obama or Bush or faceless companies and ask ourselves what we can do to make things better.""[p 256] He's right of course. but these problems are so large, and so entrenched that we can't expect the poor to simply fix their problems themselves. Those problems are endemic; most have never learned the skills, or acquired the belief they can make a difference. And, as Thomas Friedman points out, it's only going to get worse. The pace of changes from climate change, technology, and a global market (Mother Nature, Moore's Law and the Market in Friedman's shorthand) are increasing. Where once low skill jobs could bring relatively high wages - like those jobs provided by the factories that left Middletown - those days are gone and aren't coming back.
Vance argues these problems may not be fixable; the best we can do is ""put our thumb on the scale"" to help them out. One example of putting the thumb on the scale ""would recognize what my old high school's teachers see every day; the real problem for som many of these kids is what happens (or doesn't happen) at home. For example, we'd recognize that Section 8 vouchers ough to be administered in a way that doesn't segregate the poor into little enclaves."" [p 245]
I'm willing to come down off my liberal high horse to engage the problem; but we have to develop new strategies to get that thumb on the scale.

As an aside, you can get a quick look into this problem by listening to Tom Ashbrook's On Point broadcast of June 29, 2016 entitled ""Poverty, Religion, and American Frustration"". We listened to it last summer on our road trip - which is how this book originally came to be on my bookshelf."
K.A.K.,"Reviewed in the United States on February 10, 2025","I have several friends that have read Hillbilly Elegy and I decided to read it after J.D. Vance became the vice president of the United States in 2025. In this book, Mr. Vance recounts his experiences and observations of growing up poor with a tumultuous home life and how he overcame that to attend Yale Law School. It was actually one of his Yale professors, Amy Chua, who encouraged him to write a book about his journey.

I found this to be a fascinating glimpse into an American subculture that I am not a part of, but have encountered. Although it was written several years ago and before Vice President Vance began his political career, it gave me a greater appreciation for him. It will be interesting to see how his story continues to unfold."
Tami Shaikh,"Reviewed in the United States on March 12, 2020","The memoir I chose to write about is called, Hillbilly Elegy- A Memoir of a Family and Culture in Crisis. I walked through many bookstores in search of the perfect memoir, but nothing seemed to connect with me even though I have always been a fan of memoirs. The memoirs that were best sellers, all belonged to celebrities- and I really wasn’t interested in reading those.
And then last year we all watched Brett Kavanaugh get appointed, and that just triggered something in me. I was hurt, angry and just plain simple disgusted. Being a woman who has been sexually assaulted myself, I really struggled with this decision. It was a disappointment of the worst kind – like humanity had stabbed me in the back (I know it sounds dramatic but that is how I felt). It was beyond my comprehension - how and why would people support predators, racist, misogynist homophobic douchebags. I wanted to know- really wanted to understand why? That is when a friend of mine suggested J.D. Vance’s book. She suggested that it would help me to understand how “white America” was suffering. She had supported Trump all along silently, but never had the guts to come out straight and tell me. So, I decided to read it.

When I researched the book, I realized it had been a huge success ever since it was released in 2016. Two months after its release it became a best- seller, mostly because it was marketed to people like me, who were trying to grapple with the “Trump Phenomenon.” And then I read that Mitch Mconnell asked JD Vance to run for the Ohio Senate, I really wanted to know more. My anger and desire to know more increased.

The book starts out by talking about Vance’s grandparents- Papaw and Mamaw who left Kentucky for Ohio after they got married. They try their best to raise a family while struggling simultaneously with alcoholism, abuse, family dynamics and so much more. Eventually there is a “happy ending” when JD goes to Yale Law.

After reading this book I still remain confused as to the Trump Phenomenon. I think the most interesting thing he says is on page 192, where he talks about emails and conversations he has had with friends and family. Where people believing that Obamacare legislations requires microchip implementation in new patients, Alex jones stating that 9/11 was engineered by the US government, the Newtown gun massacre was also created by the Federal government, Obama citizenship status and that Obama planned to implement martial law in order to gain third term presidency.

Is Vance’s book a good story? Yes definitely. I was in awe of his gun totting grandmother who gave him unconditional love. Even though she was hardly educated she was supportive of her grandson’s education, but what about his sister? What support did she get from the family?

Coming from Pakistan myself, my father’s side of the family still despite educating girls believe that their destiny lies in marriage. Boys are encouraged to go on to obtain a further education, however girls are groomed to get married and have children at a younger age. The same way Vance was encouraged yet his sister gets married and became a teen mom, and the author talks about how happy she is and how his brother in law is a good man and his sister was lucky to have him. It was so close to what I was told when I got married, “You’re lucky to have found such a great groom.”

Having Mamaw as the matriarch of the family, was another thing that I see commonly in Pakistan. Where many of my male cousins are raised as spoilt brats- they know exactly how to marry more than once but don’t know how to hold down a job. Usually it’s the grandmothers who take care of everyone and are revered as the head of the household. Just the way Mamaw carries the emotional burden of the family and keeps them all in line.
Another thing that I found similar between Vance’s world and people living in rural Pakistan, is their belief in patriotism. I use the world belief here, because even though they love their country, they hate anyone who isn’t like them. Pakistan being a Muslim majority country, Christians are treated with contempt and as third class citizens. I see the same divisiveness in Vance’s world, his grandparents believed America to be their “second God,” yet in the next paragraph Vance goes on to talk about how most of his community members believe Obama is a Muslim. Another paragraph down he tries to justify this racism, saying that he ‘brilliant, witty, wealthy and speaks in a perfect accent- he goes on to say:

Obama strikes at the heart of our biggest insecurities. He is a good father while many of us arent’. He wears suits to his job, while we wear overalls, if we are lucky enough to have jobs at all. His wife tells us that we shouldn’t be feeding our children certain foods, and we hate her for it- not because we think she is wrong but because we know she is right. (191)

A rhetoric I’ve often heard from religious fundamentalists in Pakistan.

He also talks about his father who did try to be present in his life with whom he lived for some time. Again, I feel like he missed out on an opportunity to discuss who is his father was. Having his father present in his life after his parents divorce is not a luxury many Americans have- this has nothing to do with race or financial stability.

Another thing that stood out:

This was my world: world of truly irrational behavior. We spend our way into the poorhouse. We buy giant TVs and IPads. Our children wear nice clothes thanks to high interest credit cards and payday loans..

“we spend our way into the poorhouse”

“we purchase homes we don’t need, refinance them for more spending money, and declare bankruptcy”

“we don’t study as children, and we don’t make our kids study when we’re parents”

“we choose not to work, when we should be looking for jobs”

“we eat Pillsbury cinnamon rolls for breakfast, Taco Bell for lunch, and McDonald’s for dinner.” (146-147)

On these pages he sounds like he is a part of a cult. The book starts out with an “I” all about Vance’s life struggles and heroism, yet when it comes to talking about the flaws and racism he feels towards others- it becomes a “we.” He sounds presumptuous and insensitive in describing the lives of people who struggle on a daily basis. Vance sounds like he is trying to take the reader along with him on how “his people” live, even though he continues to talk about now being part of the elite group of Yale Law School graduates. My question - is he convincing us or himself that he is still that young boy that was raised by his grandmother in Ohio? Or is it survivor’s guilt?

I felt like Vance was more interested in writing his journey from poverty to an elite class of Yale Law school graduates- him being the savior of his people. The typical tale of a hero, who despite life being tough has gone against all odds and made it. Another thing that he lacked was emotion and feelings that he felt during his “dark times,” his style of writing comes across as cold and distant. It definitely didn’t feel like he was writing about the “family in crisis.”

All in all, I didn’t enjoy the book much at all. I still have no clue as to why people voted for and continue to support Trump. I truly believe that if people want to spread hate- they will find any reason to do that."
Sarah,"Reviewed in the United States on February 18, 2025","This biography proves that a child who has no advantages in life, either material or emotional, can rise above it all and become successful.

I can relate to J.D. Vance's experiences because I, also, grew up in Appalachia and knew families like his. The book made it obvious that it was his tour of duty in the U.S. Army that set him on the right path but it was his personal drive to succeed that got him there.

I appreciate the honesty of how that upbringing still influences him in many ways, both good and bad."
Diane,"Reviewed in the United States on December 1, 2024","The hillbilly identity always resonated with me, even though I personally grew up on the edge of the culture. Or perhaps, I just thought our way of life was normal. JD's descriptions seem to fit my grandparents generation more than my own (I'm now 69 years old) but the drinking, infidelities, coal mining jobs, distrust of government, church attendance, and personal values of honor, family loyalty, and pride ring true to me. Each of my maternal grandparents came from families of 18 children; they had 9 children including my mum. Grandma Genny was pregnant with her last child (stillborn) at the same time my mum was pregnant with her fourth child (out of five).

Grandpap owned his own ""house mine"" for a while to earn a living. He often filled neighbors' empty coal bins without getting paid, but he did it anyway because he didn't want kids to be cold. You looked out for each other.

None of my aunts or uncles went to college. My mum, the 3rd oldest, was the first to graduate from high school - even though she got pregnant, married in April, and took her husband to the prom. Her principal had seen her marriage license in the paper and greeted her on the following Monday by telling her that he ""hoped this didn't affect her school attendance"".

I guess I AM a 3rd generation hillbilly! Fortunately, people in my life guided me; my mum's proud that I was the first grandchild to graduate from college. I'm grateful to have been a teacher for 35 years, teaching children in West Virginia and Western PA - educating my kind of people. I loved them!"
M. Rader,"Reviewed in the United States on January 14, 2025","I bought this for my mother as a Christmas present as she is a big supporter of JD Vance, and she's also had a very similar upbringing to his. She continues to rave about this book. Every time I talk to her, she said that the language can get a little bit saucy, but she loves the stories and hearing how his upbringing was so similar to hers in the 40s. She wants me to read it when she's done and I probably will because I am a reader and I also like JD Vance.

Forget about politics for a minute, this book is not about that. It's about a man and how he was brought up very poor in Appalachia and what he and his family in did just to survive."
Sherrie A Bell,"Reviewed in the United States on February 15, 2025","This in some ways mirrors my own life story. I was in three homes and an orphanage. I know many of these stories and have lived the flight syndrome all my life.

Thank you sir for your vulnerability and willingness to deal with your life hurts.

Blessings and my prayers and support are with you Usha.

Your a great man JD Vance!"
Shawna White,"Reviewed in the United States on February 13, 2025","I loved this book! I am pleased to have JD Vance as our VP. I am proud to be an American. The only thing I didn't like, was all of the cursing. I understand he was trying to paint a picture of who Mamaw was but I could have done without the F bombs and the GDs."
Kindle Customer,"Reviewed in the United States on February 10, 2025","I could not put this book down. It is not political except to tell one man’s story of like as a Hillbilly in blue collar America. Vance’s story is honest , raw, and one of survival. It gives the reader a good understanding of what life in Appalachia is like. I highly recommend this book."
Grams,"Reviewed in the United States on February 13, 2025","I am enjoying the read of this book. It opens the mind to a number of things, one is being thankful and feeling blessed for the little we had growing up and thankful for what we have these days. It shows the cultural stigma, which I also grew up in, in many varieties of neglect, abuse and stigma. An East and recommended read"
Carole Duff,"Reviewed in the United States on February 11, 2025","Honest, direct, and articulate, J.D. Vance writes about his coming-of-age in a low-income Appalachian extended family with lots of disruptions and few opportunities—all as a window into a cultural crisis. No government can fix the problems of this large segment of our society, but awareness might improve policies and soften our hearts to the struggles of humanity."
happycaregiver,"Reviewed in the United States on January 25, 2025","A very personal tale of a very interesting life of our new Vice President, but one that I think will resonate with many people across the country. We may not be “hillbillies “ but we had the same issues and we are all carrying the scars. We need to keep discussing these things and working together to find better ways of dealing with them then we did, our parents did and yes, our government has. A very important read as we move into the next 4 years and hopefully see some changes for the better."
Samantha,"Reviewed in the United States on January 2, 2025","Hillbilly Eligy deeply moved me. Having grown up in abject poverty in the middle of an otherwise middle-class neighborhood really left a lasting impact on me. His words regarding the struggle of straddling two worlds, his conflicting feelings regarding his relationship with his mother (mine was mental illness not drugs like his mother), and his struggle managing big feelings as a result of his childhood trauma really resonated with me. As someone who broke their family cycle and built a better world for their own children, like JD Vance did, I have mad respect for the man and his sister. Most will not fathom the courage it took to write that book and acknowledge it publicly in an effort to shed light on a oft misunderstood segment of society from a real world personal perspective. Well done sir."
