User Name,Review Date,Review Body
Richard B. Schwartz,"Reviewed in the United States on July 3, 2017","It may be that the most interesting thing about this book is its resonance. A coming-of-age blue collar memoir, it sits (nearly) atop the bestseller list and has drawn over 7,000 Amazon reviews. While it appears to focus on a singular phenomenon its impact has been generalized by the author and now touches tens of thousands of readers.

The phenomenon is the migration of job-seeking Scots-Irish Appalachians to southwestern Ohio. I know this process intimately. My own parents were from Kentucky and settled in Cincinnati. We lived in what may be the epicenter of such migrations, a town called Norwood that is surrounded by Cincinnati. I described my experiences there in a memoir entitled THE BIGGEST CITY IN AMERICA (1999). Norwood was once home to a plethora of manufacturers, a few of which remain. U.S. Playing Card, Allis-Chalmers, American Laundry, the Fisher Body Plant (making Camaros), et al. drew workers from Appalachia who often held jobs there during the week and returned to Kentucky on the weekends. They huddled together in single homes; in Cincinnati poker parlance, a full house is a ‘full Norwood’. Now, Norwood has lost one third of its population; two of its three Catholic churches have closed and its manufacturing base has largely disappeared. What happens to people under such circumstances? Some survive, Charles Murray suggests, by maintaining social capital and making sound choices. They complete school, hold off on procreating until they are married, take a role in their community’s civic life and practice their religion.

J.D. Vance lives betwixt and between. He knows the experience of the dysfunctional and he exemplifies the possibilities of escape and success. Throughout his book, but particularly in its second half, he reflects on the manner in which some choose drugs, promiscuity and dependency, while others sustain the foundational elements of life which protect them and their families. Another way to think about this (along with the decline of manufacturing and the reduction of blue-collar opportunities) is that the 1960’s offered freedom, but part of that freedom (drugs, free love) turned out to be cataclysmic for those who allowed themselves to be set adrift. The decline of job opportunities exacerbated that situation. So too, perhaps, did the expansion of the opportunities for government dependency. Working as a clerk bagging groceries, e.g., Vance reflects on those who work the food stamp system while others invest the labor that pays for it.

This particular migration story is a powerful one. My Mizzou Chancellor, Brady Deaton, wrote his Wisconsin doctoral dissertation on it and our distinguished graduate, James Lee Burke, wrote a wonderful novel on the subject (TO THE BRIGHT AND SHINING SUN). Vance’s take on it succeeds for a number of reasons. First, the book is beautifully written and personally compelling. He offers us a privileged look into the strengths and dysfunctionalities of his own family. While the migration issue is susceptible to significant economic analysis, Vance puts living flesh on the bones of theory. He brings the story home to the reader as he explores the human hearts and souls which populate his narrative. We see real people, speaking real words and bleeding real blood. (I wish that he had included illustrations, but if you check out his Megyn Kelly interview clips you will see his beloved grandmother and sister and even catch a glimpse of his troubled mother.)

He is honest with regard to his own experience. Four years in the Marine Corps help to stabilize his life and enable him to utilize his GI Bill benefits to attend Ohio State. An old Army friend of mine once said that his most gratifying work as a company commander was helping people who had never really belonged to anything actually do so. When he moves on from Ohio State to Yale law school he reveals his cultural naivete; he never really realized, e.g., that belts and shoes are supposed to match and when he was offered Sauvignon Blanc or Chardonnay at a recruitment dinner he chose the one that was easiest to pronounce.

The book succeeds in part because it is a wonderful redemption story, but it is more complex than that. James Ellroy asked Dick Contino if he could write a novella about his life. What’s it about? Contino asked. “Heavily-compromised redemption,” Ellroy responded and Contino agreed. J.D. Vance’s redemption is not heavily-compromised, but it reveals the knife edge that he walked and the dangers that remain on the dark side, a side still inhabited by those he knows and loves. This may be the surprise hit of the year; the Harper editors who agreed to publish it were very shrewd to do so. The story gives heart to all and helps many find a voice that speaks for them."
Tom and Kristen Wannemacher,"Reviewed in the United States on January 11, 2025","The title is in reference to the book, but it could also be said about JD Vance as well. I've been wanting to read this, even moreso since the election, and I'm so glad I did. A fellow Ohioan, Conservative and a 1984 baby as well.... I cant help but relate, on the surface level. But reading this book I feel even more connected-and seen! So many times I found myself highlighting sentences, paragraphs that spoke right to my soul, and put into words how I am feeling.
The book is a wonderful mix of family drama which hives insights into how not only he grew up, but many others have as well. Of course theres the adversity and overcoming so many obstacles that really makes you want to root for him, but also the poitics and such where, after reading this, I have SO much hope for the future. I really admire JD Vance more now after reading the book and seeing where he came from..... knowing where he has made it to."
Robert A Haworth,"Reviewed in the United States on May 29, 2017","This is an engaging and insightful book about what it is like to inherit and experience the Scots-Irish culture of Appalachia, even though Vance grew up in Middletown Ohio, the grandson of grandparents who migrated to Ohio in the late 1940s from Kentucky in search of a better life. The grandparents (Mamaw & Papaw) found that better life economically, but struggled with dysfunction in their family lives. The dysfunction carried over from their culture of origin, in combination with some poor choices (Papaw became an alcoholic and a womanizer), such that family dysfunction was perpetuated to the children. JD’s mom was pregnant out of high school, then a single mom with multiple boyfriends and husbands as JD was growing up, and became addicted to pain killers. Much of the story of the book is about how JD navigated these difficult circumstances, but the takeaway is really about what it took for him to escape the usually miserable consequences of that kind of existence, ultimately graduating from Yale law school into a lucrative career.
First, the good.
a) The anecdotal features of this memoir makes the book hard to put down.
b) JD is clearly driven by the desire to understand the sociological and other issues that lie at the root of the dysfunction of his own and many other families of a similar cultural heritage. He has clearly done some study on this, and quotes from a sprinkling of academic studies to bolster his first hand observations. This is not, however, a handbook on policy, and JD is not afraid to confess his limitations.
c) In spite of the shortcomings of Mamaw and Papaw, they are clearly the heroes of the book, stepping in to raise JD in the absence of motherly responsibility. JD says they were the best thing that happened to him. They showed him the value of love and stability, believed in the value of hard work, and did their best to ensure that he had his shot at the American dream.
d) JD is brutally honest in his evaluation of his family and his cultural heritage, and does not pull any punches. In spite of this, it is clear that he loves his family and their heritage. Indeed, this drives his desire to understand why they are the way they are, as a precursor to finding solutions to those characteristics that are so socially devastating.
e) A clear message that emerges from this book is the dominant impact on children of what is taught within a family. Beyond the impact of poor job availability and opportunity, and beyond the impact of sub-par school education, though both of those are important, the attitudes that kids grow up to adopt are often those learned and observed within the family. And these attitudes can either trump or compound those other disadvantages. For example, attitudes to learning in school determine whether school is of benefit. Attitudes to work determine whether people can advance their careers.

Next, the not-so-good:
a) Those looking for answers that can shape policy may not find much to bite on. This is not really a fair criticism because the book is memoir and not a political treatise. Beyond that, JD (and his family) oscillate between thinking that the government is not doing enough to help the economic depression in Middletown (& Appalachia), and on the other hand deploring the dependence of so many of their neighbors on the dole.
Finally, some reflections on how Christian faith might speak into the above considerations.
a) JD is clearly appreciative of how strong church communities can positively impact a society, calling as he does for churches to teach kids lessons of Christian love, family & purpose. He himself was the beneficiary of that, for the short time that he was in his father’s church. His father was himself an example of the transformative power of Christ in a person’s life, having gone from being deserter of his young family to being a family man in a stable second marriage, and regular churchgoer. JD’s Mamaw too had a deep Christian faith, but despised organized religion. She taught JD that to coast through life was to squander his God-given talent, that Christian duty demanded that he take care of his family, that he needed to forgive, and that God had a plan.
b) While his father’s church had a deep impact on JD, he was subsequently to reject his faith because of aspects of evangelical theology, and doubts about the compatibility of faith and science. This speaks to how damaging it can be to the faith of young people when their church derives positions on science and faith that may be long-held but are based on poorly-grounded views of scripture. The prime example of this is the evolution/creation controversy of past centuries, but which persists today in some church cultures, especially in the USA. Somebody needs to reassure young people that they can believe in evolution and still be good Christians with a proper view of the bible. Fortunately there are signs in the book that JD has subsequently been reconsidering his rejection of the faith.
c) Even though Christian faith can result in behavioral transformation that is beneficial to the individual and to society, such transformation is merely the fruit of that faith. The origin of that faith cannot and does not lie in policy. Through the lens of faith we understand the origin of anti-social behavior to be the sin nature that we all share. Legislation has no impact on that problem. Knowing this, we may be tempted as believers to disdain efforts to help the disadvantaged and the dysfunctional among us. This would, however, not conform to the example of Jesus who was the friend of sinners and defender of the weak. It would put us more into the mold of the Pharisee who thanked God that he was not like the common riff-raff sinner. Jesus strongly condemned the superior attitude of the Pharisee. It behooves us, therefore, to be engaged with doing what we can to bring hope to the hopeless, not just of a spiritual nature but also of the physical, social, and political nature. JD testifies that he owes his rescue to a handful of loving people that rescued him. Rescue is what we should be all about, being ourselves rescued by God."
Dawn,"Reviewed in the United States on February 5, 2025","I hadn't heard of JD Vance previous to his being selected as Vice President and wanted to know more about him. I so much enjoyed his autobiographical book, ""Hillbilly Elegy"" (as well as the Netflix film)! Vance brings us into his world of poverty and despair that is the experience of so many Americans who have been forgotten and left behind. His life experiences and ability to convey the hardships and challenges he faced (and has overcome) growing up in rural America and the rust belt are ones with which millions of readers can identify. After reading this book, I understand why he is indeed exceptionally qualified to lead and help move our country out of the endless quagmire that has caused harm to so many Americans and indeed the world. JD and his wife Usha embody the American dream of success from any background -- that lends hope for our nation and its people that we can achieve great things and not settle for narratives that lead to victimhood. Bravo!"
nicole w brown,"Reviewed in the United States on January 10, 2018","ance uses his life story and that of his family and extended family in order to explain the cultural and economical ways of the hillbilly. Just what is a hillbilly? Generally, they are someone who is from the Appalachian Mountain region who is poor, rural, and working class. Sometimes undereducated. The stereotype has them with no teeth because they drink Moutain Dew and don't go to the dentist. Also that they are gun happy people ready to use them especially if you get their daughter pregnant. The heavy popping of opioid pills such as Percocet and Oxy began in the mountains of West Virginia and Kentucky, which is where the term ""pillbilly"" comes from.

Vance's Mamaw and Pawpaw came from a holler in Kentucky called Jackson. He got her pregnant at the age of thirteen and the two took the famous Route 23 out of Kentucky to Ohio (sometimes referred to as ""Middletucky"") where a good job at a steel manufacturer, Amaco, awaited. They weren't the only ones. Plenty of people from Appalachia left for jobs in Michigan, Indiana, Pennsylvania (or ""Pennsyltucky""), and Illinois. In the 1950s thirteen out of one hundred in Kentucky took the hillbilly highway out and in Harlan County Kentucky, thirty percent of its population, mostly coal miners, left.

Life was hard for his Mamaw and Pawpaw. She had several miscarriages and three children that survived. These included Uncle Jimmy, Aunt Wee, and his mother. His Pawpaw was an alcoholic and things could get ugly in their house. He would straighten himself out and while he and his wife stayed married they would end up with their own separate homes once their kids were grown, but remained close. But heaven help anyone who bothered one of the children or a member of the family. When Uncle Jimmy was five, he saw a toy in the pharmacy that he wanted for Christmas and his parents told him to go in and look at it while they finished shopping at a store. When he picked it up to play with it, the clerk in the store told him that he wasn't allowed to touch the toy and kicked the boy out of the pharmacy. When his parents found him and found out what happened they went in and trashed the place and stood up for their son's honor, because how dare someone tell their son that he can't come in their store.

He would take a while to adjust to a new place as his mother moved him and his older sister, Lydnsey, around to different homes with different men. The one constant was his Mamaw's place. Life with his mother was hard as she had a temper and in her relationships, fighting was the only way she knew how to deal with things. So dishes went flying and she would get violent with the men in her life.

According to J.D., this was how most hillbillies acted. Also, they spent money they didn't have at Christmas on fancy gifts for the kids, hoping the IRS refund check would cover it. Sometimes there would be someone in the house with a substance abuse problem. In J.D.'s case, it was his mother who got hooked on pills. They also abuse the Welfare system and try to get out of work if they can.

Vance basically says that you have to pull yourself up by your bootstraps, but most of these people don't have boots. And he had helped himself. His Mamaw received a pension check from his Papaw when he died and likely social security. He credits his Mamaw, his sister, his teachers, and the Marines with helping him to avoid going down the wrong path and instead earning his degree at Ohio State and his law degree at Yale, something practically unheard of from where he was from. He offers a lot of criticism but no solutions and he overgeneralizes and forgets the people in his life that weren't loud and violent like his sister and Uncle Jimmy and Aunt Wee and cousin Gail and their spouses. It's like he wants them to be the exception that proves the rule, but there are more of them in his life than the violent argumentative types. Also, I think there are plenty of people who are dying to get jobs of any kind if you just give them a chance. And there are programs that train people in Appalachia to learn a new trade for a company that is in the area. Vance is close to using stereotypes, though with stereotypes there is some truth to them. Read this book with caution.

*Vance is contemplating a run for office and it is my opinion that he wrote this book as a stepping stone for this purpose. But that is just my opinion.

* I add this as I think it might be interesting and be a counterpoint to the book.

I was born in poverty in Appalachia. ‘Hillbilly Elegy’ doesn’t speak for me.

J.D. Vance, author of “Hillbilly Elegy,” in Washington in January. (Astrid Riecken/For The Washington Post)

By Betsy Rader September 1, 2017

Betsy Rader is an employment lawyer at Betsy Rader Law LLC, located in Chagrin Falls, Ohio. She is running as a Democrat to represent Ohio’s 14th Congressional District in the U.S. House.

J.D. Vance’s book “Hillbilly Elegy,” published last year, has been assigned to students and book clubs across the country. Pundits continue to cite it as though the author speaks for all of us who grew up in poverty. But Vance doesn’t speak for me, nor do I believe that he speaks for the vast majority of the working poor.

From a quick glance at my résumé, you might think me an older, female version of Vance. I was born in Appalachia in the 1960s and grew up in the small city of Newark, Ohio. When I was 9, my parents divorced. My mom became a single mother of four, with only a high school education and little work experience. Life was tough; the five of us lived on $6,000 a year.

Like Vance, I attended Ohio State University on scholarship, working nights and weekends. I graduated at the top of my class and, again like Vance, attended Yale Law School on a financial-need scholarship. Today, I represent people who’ve been fired illegally from their jobs. And now that I’m running for Congress in Northeast Ohio, I speak often with folks who are trying hard but not making much money.

Although high school graduation rates are rising and there are more private and federal grants available, most low-income students have a tough time attending and staying in college. Here are nine facts about poor students and the college experience. (Video: Claritza Jimenez/Photo: iStock/The Washington Post)

A self-described conservative, Vance largely concludes that his family and peers are trapped in poverty due to their own poor choices and negative attitudes. But I take great exception when he makes statements such as: “We spend our way into the poorhouse. We buy giant TVs and iPads. Our children wear nice clothes thanks to high-interest credit cards and payday loans. We purchase homes we don’t need, refinance them for more spending money, and declare bankruptcy. . . . Thrift is inimical to our being.”

Who is this “we” of whom he speaks? Vance’s statements don’t describe the family in which I grew up, and thy don’t describe the families I meet who are struggling to make it in America today. I know that my family lived on $6,000 per year because as children, we sat down with pen and paper to help find a way for us to live on that amount. My mom couldn’t even qualify for a credit card, much less live on credit. She bought our clothes at discount stores.

Thrift was not inimical to our being; it was the very essence of our being.

With lines like “We choose not to work when we should be looking for jobs,” Vance’s sweeping stereotypes are shark bait for conservative policymakers. They feed into the mythology that the undeserving poor make bad choices and are to blame for their own poverty, so taxpayer money should not be wasted on programs to help lift people out of poverty. Now these inaccurate and dangerous generalizations have been made required college reading.

Here is the simple fact: Most poor people work. Seventy-eight percent of families on Medicaid include a household member who is working. People work hard in necessary and important jobs that often don’t pay them enough to live on. For instance, child-care workers earn an average of $22,930 per year, and home health aides average $23,600. (Indeed, it is a sad irony that crucial jobs around caretaking and children have always paid very little.)

The problem with living in constant economic insecurity is not a lack of thrift, it is that people in these circumstances are always focused on the current crisis. They can’t plan for the future because they have so much to deal with in the present. And the future seems so bleak that it feels futile to sacrifice for it. What does motivate most people is the belief that the future can be better and that we have a realistic opportunity to achieve it. But sometimes that takes help.

Yes, I worked hard, but I didn’t just pull myself up by my bootstraps. And neither did Vance. The truth is that people helped us out: My public school’s guidance counselor encouraged me to go to college. The government helped us out: I received scholarships and subsidized federal loans to help pay my educational expenses. The list of helpers goes on.

Now that so many people have read “Hillbilly Elegy” this summer, I hope they draw this better moral from the story: Individuals can make a difference in others’ lives, and by providing opportunities for all, our government can do the same. Life, liberty and the pursuit of happiness should be legitimate expectations for everyone, “hillbillies” included."
Liza,"Reviewed in the United States on February 6, 2025","I just watched JD's documentary film and am now finishing his book. It is so worth the read. I especially loved his vulnerability, describing how he never believed he could go to Yale. About the importance of safe people who are ""in the know"" who can help you along the way. And how he still sometimes struggles with an angry temper which his wife Usha helps him manage. I'd love to read a book about how that works it could help so many marriages! It is rare in deed to hear a man own their own issues and in print for all to read?! Truly, that is the sign of a leader. In his book , he is is utterly transparent about his fears and saying that one can really never forget where we came from in childhood. I thought the movie was so good. I love Amy Adams and Glen Close as his mom and Memaw. So good. I hope both the book and the movie resurge now. Many of us are from dysfunctional families in fact most are to one degree or another and keeping secrets within the family make is so much more difficult as JD describes beautifully."
ironhorseranch,"Reviewed in the United States on February 20, 2025",I watched the movie first. Being a voracious reader I immediately purchased the book for my kindle. (The book is always better than the movie). The language in this book surprised me at first. I’ve never known hillbillies maybe they do cuss up a storm! I was raised poor. My father passed at age 29. My Mom had to go to work to support us. Her parents were dead. In the 1950’s there were no social services or programs to help! I never heard a curse word until high school. JD Vance’s turning around his life circumstances is nothing short of Miraculous! I throughly enjoyed this read. And the insight it gives our now Vice President of the United States is also amazing to understanding. It is comforting to know real people are in charge in the White House! By that I mean honest people we can trust!
